name,specialization,experience,phone,img
Dr. Sanjay Algude,Homeopathy & Ayurvedic Medicine,Over 20 years of experience in integrating Homeopathy and Ayurvedic treatments,+91 9850615151,
Dr. Amit Sheth,MBBS, Homeopathy & Herbal Wellness,Combines modern medicine with traditional herbal wellness approaches,+91 8275960639,
Dr. Priya Sharma,Ayurvedic Medicine & Panchakarma,Renowned Ayurvedic physician specializing in Panchakarma detoxification therapies,+91 9876543210,
Dr. Rajesh Kumar,Naturopathy & Yoga Therapy,Certified Naturopath and Yoga therapist with expertise in treating stress-related disorders,+91 9123456789,
Dr. Meena Patel,Herbal Dermatology,Specializes in treating skin conditions using herbal and Ayurvedic formulations,+91 9988776655,
Dr. Arun Krishnan,Traditional Siddha Medicine,Expert in Siddha medicine, specializing in respiratory ailments and digestive disorders,+91 9445566778,